{
    "format": "GymAppRoutineExport",
    "formatVersion": 1,
    "exportedAt": "2026-01-06T12:34:56.789Z",
    "app": {
        "name": "Simple Gym Routine Tracker",
        "storageNamespace": "routinetracker_v1"
    },
    "routine": {
        "id": "rt_example_push01",
        "name": "Push Day A",
        "description": "Chest + triceps focus",
        "series": [
            {
                "id": "ss_example_warmup01",
                "description": "Warm-up",
                "restSecondsAfter": 60,
                "exercise": {
                    "description": "Bench Press"
                },
                "repGroups": [
                    {
                        "id": "rg_example_warmup01",
                        "laterality": "bilateral",
                        "targetReps": 10,
                        "targetWeight": 40,
                        "restSecondsAfter": 90,
                        "history": []
                    }
                ]
            },
            {
                "id": "ss_example_working01",
                "description": "Working sets",
                "restSecondsAfter": 120,
                "exercise": {
                    "description": "Bench Press"
                },
                "repGroups": [
                    {
                        "id": "rg_example_working01",
                        "laterality": "bilateral",
                        "targetReps": 8,
                        "targetWeight": 80,
                        "restSecondsAfter": 180,
                        "history": [
                            {
                                "dateTime": "2025-12-26T18:45:00.000Z",
                                "reps": 8,
                                "weight": 80
                            }
                        ]
                    }
                ]
            },
            {
                "id": "ss_example_shoulder01",
                "description": "",
                "restSecondsAfter": 90,
                "exercise": {
                    "description": "Dumbbell Shoulder Press"
                },
                "repGroups": [
                    {
                        "id": "rg_example_shoulder01",
                        "laterality": "unilateral",
                        "targetReps": 10,
                        "targetWeight": {
                            "left": 16,
                            "right": 18
                        },
                        "restSecondsAfter": 120,
                        "history": [
                            {
                                "dateTime": "2025-12-20T17:10:00.000Z",
                                "reps": 10,
                                "weight": {
                                    "left": 14,
                                    "right": 16
                                }
                            }
                        ]
                    }
                ]
            }
        ]
    }
}